{
  "schema_version": "0.1.0",
  "fairness": {
    "match_exploration_budget": true,
    "shared_validation_protocol": true,
    "freeze_hparams_before_test": true,
    "report_compute_and_params": true
  },
  "system_families": [
    {
      "name": "monolithic_recurrent_world_model",
      "enabled": true,
      "category": "recurrent",
      "notes": "Generic strong baseline without explicit memory partitioning."
    },
    {
      "name": "persistent_memory_world_model",
      "enabled": true,
      "category": "memory_augmented",
      "notes": "Memory-heavy baseline for long-horizon partial observability."
    },
    {
      "name": "structured_dynamics_world_model",
      "enabled": true,
      "category": "structured_dynamics",
      "notes": "Baseline emphasizing structured transition dynamics."
    },
    {
      "name": "relational_graph_world_model",
      "enabled": true,
      "category": "relational",
      "notes": "Sparse relational baseline for embodied structure."
    },
    {
      "name": "classical_belief_update_planner",
      "enabled": true,
      "category": "classical_belief_update",
      "notes": "Classical occupancy-map baseline that detects local post-intervention mismatches and updates edges, costs, dynamics, and token bindings before replanning."
    },
    {
      "name": "pretrained_structured_graph_world_model",
      "enabled": true,
      "category": "pretrained_structured_graph",
      "notes": "Higher-capacity structured graph world model pretrained across generated train motifs and evaluated as an append-only learned baseline."
    },
    {
      "name": "prismx_reference_model",
      "enabled": false,
      "category": "reference_structured",
      "notes": "Not part of the release artifact because this reference model is not implemented."
    }
  ],
  "sanity_baselines": [
    "oracle_post_intervention_planner",
    "same_environment_upper_baseline",
    "weak_heuristic_baseline"
  ],
  "seed_counts": {
    "pilot": 2,
    "main": 5,
    "bootstrap_reporting": 5
  }
}
